{
  "$schema_version": "ni-spec/2.0",
  "meta": {
    "block": "NI signal interface (top-level)",
    "spec_version": "v0.4.0",
    "reset_signals": [
      "arst_ni",
      "noc_rst_ni"
    ]
  },
  "block_enables": [
    {
      "name": "EN_MST_PORT",
      "type": "bool",
      "default": "true",
      "constraint_text": "EN_SLV_PORT || EN_MST_PORT"
    },
    {
      "name": "EN_SLV_PORT",
      "type": "bool",
      "default": "true",
      "constraint_text": "EN_SLV_PORT || EN_MST_PORT"
    }
  ],
  "interfaces": [
    {
      "name": "AXI_SLAVE_PORT",
      "block": "NMU",
      "direction": "in request, out response",
      "protocol": "AXI4",
      "clock": "aclk_i",
      "reset": "arst_ni",
      "channels": [
        {
          "name": "AW",
          "direction": "input",
          "carrier": "request",
          "signals": [
            {
              "width_param": "NOC_ID_WIDTH",
              "pin_name": "axi_awid_i",
              "reset_behavior": {
                "kind": "external_driven"
              },
              "presence": null,
              "width_expr": null
            },
            {
              "width_param": "AXI_ADDR_WIDTH",
              "pin_name": "axi_awaddr_i",
              "reset_behavior": {
                "kind": "external_driven"
              },
              "presence": null,
              "width_expr": null
            },
            {
              "width_param": "AXI_LEN_WIDTH",
              "pin_name": "axi_awlen_i",
              "reset_behavior": {
                "kind": "external_driven"
              },
              "presence": null,
              "width_expr": null
            },
            {
              "width_param": "AXI_SIZE_WIDTH",
              "pin_name": "axi_awsize_i",
              "reset_behavior": {
                "kind": "external_driven"
              },
              "presence": null,
              "width_expr": null
            },
            {
              "width_param": "AXI_BURST_WIDTH",
              "pin_name": "axi_awburst_i",
              "reset_behavior": {
                "kind": "external_driven"
              },
              "presence": null,
              "width_expr": null
            },
            {
              "width_param": "AXI_CACHE_WIDTH",
              "pin_name": "axi_awcache_i",
              "reset_behavior": {
                "kind": "external_driven"
              },
              "presence": null,
              "width_expr": null
            },
            {
              "width_param": "AXI_LOCK_WIDTH",
              "pin_name": "axi_awlock_i",
              "reset_behavior": {
                "kind": "external_driven"
              },
              "presence": null,
              "width_expr": null
            },
            {
              "width_param": "AXI_PROT_WIDTH",
              "pin_name": "axi_awprot_i",
              "reset_behavior": {
                "kind": "external_driven"
              },
              "presence": null,
              "width_expr": null
            },
            {
              "width_param": "AXI_REGION_WIDTH",
              "pin_name": "axi_awregion_i",
              "reset_behavior": {
                "kind": "external_driven"
              },
              "presence": null,
              "width_expr": null
            },
            {
              "width_param": "AXI_AWUSER_WIDTH",
              "pin_name": "axi_awuser_i",
              "reset_behavior": {
                "kind": "external_driven"
              },
              "presence": null,
              "width_expr": null
            },
            {
              "width_param": "AXI_QOS_WIDTH",
              "pin_name": "axi_awqos_i",
              "reset_behavior": {
                "kind": "external_driven"
              },
              "presence": null,
              "width_expr": null
            }
          ]
        },
        {
          "name": "W",
          "direction": "input",
          "carrier": "request",
          "signals": [
            {
              "width_param": "AXI_DATA_WIDTH",
              "pin_name": "axi_wdata_i",
              "reset_behavior": {
                "kind": "external_driven"
              },
              "presence": null,
              "width_expr": null
            },
            {
              "width_param": "AXI_STRB_WIDTH",
              "pin_name": "axi_wstrb_i",
              "reset_behavior": {
                "kind": "external_driven"
              },
              "presence": null,
              "width_expr": null
            },
            {
              "width_param": "AXI_LAST_WIDTH",
              "pin_name": "axi_wlast_i",
              "reset_behavior": {
                "kind": "external_driven"
              },
              "presence": null,
              "width_expr": null
            },
            {
              "width_param": "AXI_WUSER_WIDTH",
              "pin_name": "axi_wuser_i",
              "reset_behavior": {
                "kind": "external_driven"
              },
              "presence": null,
              "width_expr": null
            }
          ]
        },
        {
          "name": "AR",
          "direction": "input",
          "carrier": "request",
          "signals": [
            {
              "width_param": "NOC_ID_WIDTH",
              "pin_name": "axi_arid_i",
              "reset_behavior": {
                "kind": "external_driven"
              },
              "presence": null,
              "width_expr": null
            },
            {
              "width_param": "AXI_ADDR_WIDTH",
              "pin_name": "axi_araddr_i",
              "reset_behavior": {
                "kind": "external_driven"
              },
              "presence": null,
              "width_expr": null
            },
            {
              "width_param": "AXI_LEN_WIDTH",
              "pin_name": "axi_arlen_i",
              "reset_behavior": {
                "kind": "external_driven"
              },
              "presence": null,
              "width_expr": null
            },
            {
              "width_param": "AXI_SIZE_WIDTH",
              "pin_name": "axi_arsize_i",
              "reset_behavior": {
                "kind": "external_driven"
              },
              "presence": null,
              "width_expr": null
            },
            {
              "width_param": "AXI_BURST_WIDTH",
              "pin_name": "axi_arburst_i",
              "reset_behavior": {
                "kind": "external_driven"
              },
              "presence": null,
              "width_expr": null
            },
            {
              "width_param": "AXI_CACHE_WIDTH",
              "pin_name": "axi_arcache_i",
              "reset_behavior": {
                "kind": "external_driven"
              },
              "presence": null,
              "width_expr": null
            },
            {
              "width_param": "AXI_LOCK_WIDTH",
              "pin_name": "axi_arlock_i",
              "reset_behavior": {
                "kind": "external_driven"
              },
              "presence": null,
              "width_expr": null
            },
            {
              "width_param": "AXI_PROT_WIDTH",
              "pin_name": "axi_arprot_i",
              "reset_behavior": {
                "kind": "external_driven"
              },
              "presence": null,
              "width_expr": null
            },
            {
              "width_param": "AXI_REGION_WIDTH",
              "pin_name": "axi_arregion_i",
              "reset_behavior": {
                "kind": "external_driven"
              },
              "presence": null,
              "width_expr": null
            },
            {
              "width_param": "AXI_ARUSER_WIDTH",
              "pin_name": "axi_aruser_i",
              "reset_behavior": {
                "kind": "external_driven"
              },
              "presence": null,
              "width_expr": null
            },
            {
              "width_param": "AXI_QOS_WIDTH",
              "pin_name": "axi_arqos_i",
              "reset_behavior": {
                "kind": "external_driven"
              },
              "presence": null,
              "width_expr": null
            }
          ]
        },
        {
          "name": "B",
          "direction": "output",
          "carrier": "response",
          "signals": [
            {
              "width_param": "NOC_ID_WIDTH",
              "pin_name": "axi_bid_o",
              "reset_behavior": {
                "kind": "async-active-low",
                "value": "0",
                "domain": "arst_ni"
              },
              "presence": null,
              "width_expr": null
            },
            {
              "width_param": "AXI_RESP_WIDTH",
              "pin_name": "axi_bresp_o",
              "reset_behavior": {
                "kind": "async-active-low",
                "value": "0",
                "domain": "arst_ni"
              },
              "presence": null,
              "width_expr": null
            },
            {
              "width_param": "AXI_BUSER_WIDTH",
              "pin_name": "axi_buser_o",
              "reset_behavior": {
                "kind": "async-active-low",
                "value": "0",
                "domain": "arst_ni"
              },
              "presence": null,
              "width_expr": null
            }
          ]
        },
        {
          "name": "R",
          "direction": "output",
          "carrier": "response",
          "signals": [
            {
              "width_param": "NOC_ID_WIDTH",
              "pin_name": "axi_rid_o",
              "reset_behavior": {
                "kind": "async-active-low",
                "value": "0",
                "domain": "arst_ni"
              },
              "presence": null,
              "width_expr": null
            },
            {